<?xml version="1.0" encoding="UTF-8"?>
<!DOCTYPE katalog SYSTEM "katalog.dtd"> 
<!-- Burada alınacak kurallar dizisi katalog.dtd dosyasından alınır -->
<katalog>
  <kitaplar>
    <!-- id niteliği zorunludur, baski niteliği isteğe bağlıdır -->
    <kitap id="bk1"> 
      <yazar>J. K. Rowling</yazar>
      <baslik>Harry Potter</baslik>
      <tur>Fantastik</tur>
      <fiyat>40</fiyat>
    </kitap>
    <!-- hem id hem de baski niteliği var -->
    <kitap id="bk2" baski="3. baski">
      <yazar>Miguel de Cervantes</yazar>
      <baslik>Don Kişot</baslik>
      <fiyat>50</fiyat>
    </kitap>
  </kitaplar>

  <plaklar>
    <!-- Birden fazla şarkıcıya sahip olabilir -->
    <plak>
      <album>Love for Sale</album>
      <sarkici>Tony Bennett</sarkici>
      <sarkici>Lady Gaga</sarkici>
      <yili>2021</yili>
    </plak>
    <plak>
      <album>Back in Black</album>
      <sarkici>AC/DC</sarkici>
      <yili>1980</yili>
    </plak>
  </plaklar>
</katalog>